{
  "schemaVersion": 1,
  "minecraftVersion": "1.11.2",
  "protocolVersion": 316,
  "sourceRoot": "client/1.11.2/src/main/java",
  "registrationSources": [
    {
      "path": "net/minecraft/network/EnumConnectionState.java",
      "sha256": "082ab3c1cee51c9cd37030868924e11043a34142a2b5752fe065f1828c9f7525"
    }
  ],
  "layoutCoverage": "partial",
  "states": {
    "handshaking": {
      "serverbound": {
        "ids": {
          "C00Handshake": 0
        },
        "layouts": {}
      },
      "clientbound": {
        "ids": {},
        "layouts": {}
      }
    },
    "status": {
      "serverbound": {
        "ids": {
          "CPacketServerQuery": 0,
          "CPacketPing": 1
        },
        "layouts": {
          "CPacketServerQuery": {
            "source": "net/minecraft/network/status/client/CPacketServerQuery.java",
            "fields": []
          },
          "CPacketPing": {
            "source": "net/minecraft/network/status/client/CPacketPing.java",
            "fields": [
              {
                "name": "clientTime",
                "type": "long"
              }
            ]
          }
        }
      },
      "clientbound": {
        "ids": {
          "SPacketServerInfo": 0,
          "SPacketPong": 1
        },
        "layouts": {
          "SPacketPong": {
            "source": "net/minecraft/network/status/server/SPacketPong.java",
            "fields": [
              {
                "name": "clientTime",
                "type": "long"
              }
            ]
          }
        }
      }
    },
    "login": {
      "serverbound": {
        "ids": {
          "CPacketLoginStart": 0,
          "CPacketEncryptionResponse": 1
        },
        "layouts": {}
      },
      "clientbound": {
        "ids": {
          "SPacketDisconnect": 0,
          "SPacketEncryptionRequest": 1,
          "SPacketLoginSuccess": 2,
          "SPacketEnableCompression": 3
        },
        "layouts": {
          "SPacketEnableCompression": {
            "source": "net/minecraft/network/login/server/SPacketEnableCompression.java",
            "fields": [
              {
                "name": "compressionThreshold",
                "type": "varint"
              }
            ]
          }
        }
      }
    },
    "play": {
      "serverbound": {
        "ids": {
          "CPacketConfirmTeleport": 0,
          "CPacketTabComplete": 1,
          "CPacketChatMessage": 2,
          "CPacketClientStatus": 3,
          "CPacketClientSettings": 4,
          "CPacketConfirmTransaction": 5,
          "CPacketEnchantItem": 6,
          "CPacketClickWindow": 7,
          "CPacketCloseWindow": 8,
          "CPacketCustomPayload": 9,
          "CPacketUseEntity": 10,
          "CPacketKeepAlive": 11,
          "CPacketPlayer.Position": 12,
          "CPacketPlayer.PositionRotation": 13,
          "CPacketPlayer.Rotation": 14,
          "CPacketPlayer": 15,
          "CPacketVehicleMove": 16,
          "CPacketSteerBoat": 17,
          "CPacketPlayerAbilities": 18,
          "CPacketPlayerDigging": 19,
          "CPacketEntityAction": 20,
          "CPacketInput": 21,
          "CPacketResourcePackStatus": 22,
          "CPacketHeldItemChange": 23,
          "CPacketCreativeInventoryAction": 24,
          "CPacketUpdateSign": 25,
          "CPacketAnimation": 26,
          "CPacketSpectate": 27,
          "CPacketPlayerTryUseItemOnBlock": 28,
          "CPacketPlayerTryUseItem": 29
        },
        "layouts": {
          "CPacketConfirmTeleport": {
            "source": "net/minecraft/network/play/client/CPacketConfirmTeleport.java",
            "fields": [
              {
                "name": "telportId",
                "type": "varint"
              }
            ]
          },
          "CPacketChatMessage": {
            "source": "net/minecraft/network/play/client/CPacketChatMessage.java",
            "fields": [
              {
                "name": "message",
                "type": "utf8"
              }
            ]
          },
          "CPacketConfirmTransaction": {
            "source": "net/minecraft/network/play/client/CPacketConfirmTransaction.java",
            "fields": [
              {
                "name": "windowId",
                "type": "byte"
              },
              {
                "name": "uid",
                "type": "short"
              },
              {
                "name": "accepted",
                "type": "boolean"
              }
            ]
          },
          "CPacketEnchantItem": {
            "source": "net/minecraft/network/play/client/CPacketEnchantItem.java",
            "fields": [
              {
                "name": "windowId",
                "type": "byte"
              },
              {
                "name": "button",
                "type": "byte"
              }
            ]
          },
          "CPacketCloseWindow": {
            "source": "net/minecraft/network/play/client/CPacketCloseWindow.java",
            "fields": [
              {
                "name": "windowId",
                "type": "byte"
              }
            ]
          },
          "CPacketKeepAlive": {
            "source": "net/minecraft/network/play/client/CPacketKeepAlive.java",
            "fields": [
              {
                "name": "key",
                "type": "varint"
              }
            ]
          },
          "CPacketPlayer.Position": {
            "source": "net/minecraft/network/play/client/CPacketPlayer.java",
            "fields": [
              {
                "name": "x",
                "type": "double"
              },
              {
                "name": "y",
                "type": "double"
              },
              {
                "name": "z",
                "type": "double"
              },
              {
                "name": "onGround",
                "type": "boolean"
              }
            ]
          },
          "CPacketPlayer.PositionRotation": {
            "source": "net/minecraft/network/play/client/CPacketPlayer.java",
            "fields": [
              {
                "name": "x",
                "type": "double"
              },
              {
                "name": "y",
                "type": "double"
              },
              {
                "name": "z",
                "type": "double"
              },
              {
                "name": "yaw",
                "type": "float"
              },
              {
                "name": "pitch",
                "type": "float"
              },
              {
                "name": "onGround",
                "type": "boolean"
              }
            ]
          },
          "CPacketPlayer.Rotation": {
            "source": "net/minecraft/network/play/client/CPacketPlayer.java",
            "fields": [
              {
                "name": "yaw",
                "type": "float"
              },
              {
                "name": "pitch",
                "type": "float"
              },
              {
                "name": "onGround",
                "type": "boolean"
              }
            ]
          },
          "CPacketPlayer": {
            "source": "net/minecraft/network/play/client/CPacketPlayer.java",
            "fields": [
              {
                "name": "onGround",
                "type": "boolean"
              }
            ]
          },
          "CPacketVehicleMove": {
            "source": "net/minecraft/network/play/client/CPacketVehicleMove.java",
            "fields": [
              {
                "name": "x",
                "type": "double"
              },
              {
                "name": "y",
                "type": "double"
              },
              {
                "name": "z",
                "type": "double"
              },
              {
                "name": "yaw",
                "type": "float"
              },
              {
                "name": "pitch",
                "type": "float"
              }
            ]
          },
          "CPacketSteerBoat": {
            "source": "net/minecraft/network/play/client/CPacketSteerBoat.java",
            "fields": [
              {
                "name": "left",
                "type": "boolean"
              },
              {
                "name": "right",
                "type": "boolean"
              }
            ]
          },
          "CPacketHeldItemChange": {
            "source": "net/minecraft/network/play/client/CPacketHeldItemChange.java",
            "fields": [
              {
                "name": "slotId",
                "type": "short"
              }
            ]
          },
          "CPacketSpectate": {
            "source": "net/minecraft/network/play/client/CPacketSpectate.java",
            "fields": [
              {
                "name": "id",
                "type": "uuid"
              }
            ]
          }
        }
      },
      "clientbound": {
        "ids": {
          "SPacketSpawnObject": 0,
          "SPacketSpawnExperienceOrb": 1,
          "SPacketSpawnGlobalEntity": 2,
          "SPacketSpawnMob": 3,
          "SPacketSpawnPainting": 4,
          "SPacketSpawnPlayer": 5,
          "SPacketAnimation": 6,
          "SPacketStatistics": 7,
          "SPacketBlockBreakAnim": 8,
          "SPacketUpdateTileEntity": 9,
          "SPacketBlockAction": 10,
          "SPacketBlockChange": 11,
          "SPacketUpdateBossInfo": 12,
          "SPacketServerDifficulty": 13,
          "SPacketTabComplete": 14,
          "SPacketChat": 15,
          "SPacketMultiBlockChange": 16,
          "SPacketConfirmTransaction": 17,
          "SPacketCloseWindow": 18,
          "SPacketOpenWindow": 19,
          "SPacketWindowItems": 20,
          "SPacketWindowProperty": 21,
          "SPacketSetSlot": 22,
          "SPacketCooldown": 23,
          "SPacketCustomPayload": 24,
          "SPacketCustomSound": 25,